{
  "schema_version": "goal-teams-active-generation-v1",
  "generation_id": "V2.68",
  "activation_manifest": "references/current/generations/V2.68/activation-manifest.json",
  "activation_manifest_sha256": "7c9971b076e8eae19db8cbc6805e1c9159a3871023ba6a748400aea166d92a2d",
  "state": "active_current",
  "updated_at": "2026-09-08T04:52:32+00:00"
}
